Código,Título,Descripción,Fuente,Categoría
COFOG,Clasificación de las funciones del gobierno,"Un estándar que clasifica los propósitos de las actividades gubernamentales, desarrollada por la Organización para la Cooperación y el Desarrollo Económicos y publicada por la División de Estadística de las Naciones Unidas.",https://unstats.un.org/unsd/classifications/Econ/,organization
TED_CA_TYPE,EU Type of contracting authority (TED schema),The types of contracting authority within the domain of public procurement according to the legislation of the European Parliament. This scheme's codes match those in TED schema.,https://ted.europa.eu/documents/d/ted/en_f01,organization
TED_CE_ACTIVITY,EU Main activity of contracting entity (TED schema),The main activity of the contracting entity within the domain of public procurement according to the legislation of the European Parliament. This scheme's codes match those in TED schema.,https://ted.europa.eu/documents/d/ted/en_f04,organization
eu-buyer-contracting-type,EU Buyer contracting entity type (eForms),Whether or not the buyer is a contracting entity within the domain of public procurement according to the legislation of the European Parliament.,https://docs.ted.europa.eu/eforms/latest/reference/code-lists/buyer-contracting-type.html,organization
eu-main-activity,EU Main activity authority list (eForms),The main activity of the contracting entity within the domain of public procurement according to the legislation of the European Parliament. This scheme's codes match those in eForms.,https://op.europa.eu/en/web/eu-vocabularies/concept-scheme/-/resource?uri=http://publications.europa.eu/resource/authority/main-activity,organization
eu-buyer-legal-type,EU Buyer legal type (eForms),The type of the procuring authority within the domain of public procurement according to the legislation of the European Parliament. This scheme's codes match those in eForms.,https://op.europa.eu/en/web/eu-vocabularies/concept-scheme/-/resource?uri=http://publications.europa.eu/resource/authority/buyer-legal-type,organization
